{
  "authority_boundary": {
    "allowed_outputs": [
      "CANDIDATE",
      "EVIDENCE",
      "HOLD",
      "AUTHORIZATION_REQUEST",
      "HUMAN_REPLY",
      "TOTAL_FIELD_DECISION_RECEIPT"
    ],
    "forbidden_authority": [
      "ALLOW",
      "COMMITTED",
      "COMMIT_APPLIED",
      "TFS",
      "TFID",
      "TOTAL_FIELD_HASH",
      "CANONICAL_POINTER",
      "FINAL_SEAL",
      "DIRECT_DB_WRITE",
      "DIRECT_DEPLOY"
    ],
    "human_final_effect_classes": [
      "E4",
      "E5"
    ],
    "total_field_receiver_ref": "TOTAL_FIELD_SKILL_GOVERNANCE_RECEIVER",
    "total_field_receiver_required": true
  },
  "authorization_contract": {
    "effect_and_risk_explanation_required": true,
    "expiry_required": true,
    "input_hashes_required": true,
    "required_for_effect_classes": [
      "E3",
      "E4",
      "E5"
    ],
    "rollback_required": true,
    "single_use": true,
    "stop_conditions_required": true,
    "total_field_review_required": true
  },
  "classification": {
    "maximum_effect_class": "E2",
    "primary_family": "F20",
    "secondary_families": [
      "F02",
      "F03",
      "F04",
      "F12",
      "F17",
      "F19"
    ]
  },
  "d1_d8_projection": {
    "D1": {
      "contract": "記錄要定義、盤點、審查、啟用、暫停或退場的直接技能治理意圖。",
      "name": "INTENT",
      "required": true
    },
    "D2": {
      "contract": "記錄技能 manifest、版本、生命週期、先前裁決與目前產品輸出狀態。",
      "name": "STATE",
      "required": true
    },
    "D3": {
      "contract": "記錄技能、節點、路徑、角色、Seat、會員邊界、carrier、receiver、邏輯時間，以及適用時的 ADI 整數決策、時空網路與非權威浮點資料座標。",
      "name": "COORDINATE",
      "required": true
    },
    "D4": {
      "contract": "記錄來源、manifest、schema、實作、測試、紅隊、receipt、六軸技術身分與 EV 證據、浮點數值契約與重播結果，以及 SHA-256 證據。",
      "name": "EVIDENCE",
      "required": true
    },
    "D5": {
      "contract": "貫穿式執行 Gate、Guard、Policy、效果分類、append-only 歷史、禁止條件、授權與 rollback。",
      "name": "EXECUTION_POLICY",
      "required": true
    },
    "D6": {
      "contract": "只有技能明確主張 W7TP 時才要求 V2.3 意圖通訊／狀態場封包通訊、自帶協定與驗證的可重構封包；保存 ADI 整數決策索引與時空索引網路，宣告連續運算時另保存非權威浮點資料索引及數值契約；一般 carrier 不算。",
      "name": "GENERATIVE_TRANSMISSION",
      "required": true
    },
    "D7": {
      "contract": "執行定義前、啟用前及操作後紅隊，檢查效果類比冒充技術身分、六軸缺漏、加權分數、carrier 與重構混淆、專利推論、ADI 索引權責、浮點資料升格、H64-TD 與靜默覆寫，保存 finding、修復與 closure evidence。",
      "name": "RED_TEAM_RISK_CONFINEMENT",
      "required": true
    },
    "D8": {
      "contract": "綁定 nonce、TTL、hash、權限、Total Field receiver、裁決 receipt 與最終權威邊界。",
      "name": "ENVELOPE_AUTHORITY",
      "required": true
    }
  },
  "display_name_zh": "總場技能治理",
  "evidence_and_hashes": {
    "canonical_refs": [
      "manifests/total_field/w7tp_8d_adi_v2_3_canonical/CONTRACT.json"
    ],
    "evidence_destination": "artifacts/8d-adi-workloop/six-core-skills-v23-upgrade-candidate-20261024T015400Z8/evidence/",
    "hash_algorithm": "SHA-256",
    "implementation_refs": [
      "SKILL.md",
      "agents/openai.yaml",
      "assets/icon.svg",
      "references/capability-interoperability.md",
      "references/capability-source-index.json",
      "references/core_skill_family_catalog_v1.json",
      "references/current-design-contract.json",
      "references/evolution-contract.json",
      "references/identity-seat-and-context.md",
      "references/lifecycle-and-total-field.md",
      "references/red-team-hold-and-authorization.md",
      "references/skill-definition-contract.md",
      "references/skill-taxonomy.md",
      "references/technology-identity-manifest-contract.md",
      "references/total_field_skill_manifest_v1.schema.json",
      "references/version-observation-causality.md",
      "scripts/inventory_skill_definitions.py",
      "scripts/validate_governance_design.py",
      "scripts/validate_skill_manifest.py"
    ],
    "implementation_sha256": {
      "SKILL.md": "0d71c0268b616468c92f4a2b79bcdf1beb77c9e231233e55dfb89229af0a1eb8",
      "agents/openai.yaml": "793efc292157906094a2c637387f613ddc2456db050670234e75b39c35a06757",
      "assets/icon.svg": "51a6923974188748638a424aa59b42b6afad2d910f910a1d43bb13ee10f3ce26",
      "references/capability-interoperability.md": "428cbfb61af3ac5076432cfd188b2084c7ef88ae2b12dacb72f1c146c8113e31",
      "references/capability-source-index.json": "bd4824a4bdbcd0a3065e966aa6eace48049becb9cd0d21495cd64af34d1c05d0",
      "references/core_skill_family_catalog_v1.json": "ac1dc6c8cdf68799cd5cef0148a046d88a74de5c53315feaf9f569bb423beca4",
      "references/current-design-contract.json": "4d78ae3fc21c5c16153ea202497b4445026fd80d7ea77e9ee38ee9a4c88317d1",
      "references/evolution-contract.json": "6f1bca74a6b5af57a014a8d2b9977345530f86c451ccc4259c7235ea3d2ccbe7",
      "references/identity-seat-and-context.md": "9c22b63fa59e8ad730b7cd2eda943d2155c0ea54a76bb09af253565e0793a8c0",
      "references/lifecycle-and-total-field.md": "abea17ece3dd97e7fe2619d8b528735dad9545d2a567ef3b071207f8b21175dc",
      "references/red-team-hold-and-authorization.md": "b56b0752fb3977da1e642d5d2cc6f02db29c9a0597eadb662134f0f480690aa7",
      "references/skill-definition-contract.md": "0939a57b846b3703da37facd583222a342be4f67e51c79695831de1d5949f5ff",
      "references/skill-taxonomy.md": "787307ff83652aa52a5d5caa1c5d559fc697a6b1924e1de258cd3a829100a794",
      "references/technology-identity-manifest-contract.md": "6a5cda0f189bdc3ff53411bdff041bebba7f778ab2ba936ddddf9ad414df06db",
      "references/total_field_skill_manifest_v1.schema.json": "6e01768404adc0ae573668172d4411f26008b18cbc2903bcc8cdb20f3c072797",
      "references/version-observation-causality.md": "3824e2f3ea7b7f129a1f0d34a44c01b7e38e2d3e6989e613982347bb216ccdb2",
      "scripts/inventory_skill_definitions.py": "57c5d2c1dd47ee49fb33382edeb1b8b0668b2000fd645462af7dbf6203d59734",
      "scripts/validate_governance_design.py": "72c78b0828cecd971edd41a050f48f4343ce901c44c150c3a5c9ca4fc1db7422",
      "scripts/validate_skill_manifest.py": "508f9aa39132e06c78fca78c4d8a17af28c4cac232a25f01c47eb85ea99100eb"
    },
    "manifest_hash_excludes_field": "evidence_and_hashes.manifest_self_hash",
    "manifest_self_hash": "PENDING_TOTAL_FIELD_SEAL",
    "schema_refs": [
      "references/total_field_skill_manifest_v1.schema.json"
    ]
  },
  "execution_contract": {
    "carriers": [
      "LOCAL_FILESYSTEM",
      "SSH_OR_TAILSCALE_CARRIER_ONLY"
    ],
    "dependencies": [
      "PYTHON_3_STANDARD_LIBRARY",
      "ACTIVE_TOTAL_FIELD_CANONICAL_REFS",
      "ADI_FLOATING_POINT_DATA_INDEX_CONTRACT_WHEN_DECLARED",
      "W7TP_TECHNOLOGY_IDENTITY_AUDIT@1.0.0",
      "VALID_MEMBER_XIAOJ_SEAT_PROFILE"
    ],
    "existing_state_preserved": true,
    "forbidden_effects": [
      "LIVE_DB_WRITE",
      "DEPLOY",
      "RESTART",
      "ROUTER_WRITE",
      "CANONICAL_CHANGE",
      "POINTER_CHANGE",
      "ROLE_OR_SEAT_CHANGE",
      "SECRET_READ",
      "MEMBER_PLAINTEXT_READ",
      "FORMAL_SUBMISSION"
    ],
    "nodes": [
      "DEVELOPER_DEVICE",
      "TOTAL_FIELD_NODE"
    ],
    "persistent_side_effects": [
      "VERSIONED_SKILL_DEFINITION_CANDIDATE_FILES"
    ],
    "resource_limits": {
      "container_required": false,
      "gpu_required": false,
      "network_required": false
    },
    "rollback": "僅移除或停用本次新建且尚未經總場啟用的技能候選；保留既有技能、manifest、receipt、會員資料及證據。"
  },
  "founder_authority_ref": "TOTAL_FIELD_CANONICAL_FOUNDER_NATURAL_PERSON_AUTHORITY",
  "hold_contract": {
    "language": "zh-Hant",
    "one_solution": true,
    "raw_code_only_forbidden": true,
    "required_fields": [
      "question",
      "answer",
      "risk_found",
      "possible_effect",
      "protected_state",
      "solution",
      "user_action_required"
    ]
  },
  "identity_and_seat": {
    "access_profile_refs": [
      "LLM_IDENTITY_ACCESS_PROFILE_FOUNDER_DEVELOPER",
      "LLM_IDENTITY_ACCESS_PROFILE_TOTAL_FIELD_REVIEWER"
    ],
    "active_seat_required": true,
    "allowed_roles": [
      "FOUNDER_DEVELOPER",
      "TOTAL_FIELD_REVIEWER"
    ],
    "cross_member_plaintext_allowed": false,
    "fixed_role_capacity_required": true,
    "member_required": true,
    "reservation_non_executable": true,
    "xiaoj_identity_required": true
  },
  "information_context": {
    "identity_derived_scope": true,
    "protected_representation": [
      "OPAQUE_HANDLE",
      "TYPED_CLAIM",
      "SHA256",
      "DEIDENTIFIED_EVIDENCE",
      "STRUCTURAL_METADATA"
    ],
    "provenance_required": true,
    "raw_protected_context_allowed": false,
    "required_field_domains": [
      "D1",
      "D2",
      "D3",
      "D4",
      "D5",
      "D6",
      "D7",
      "D8"
    ],
    "retention": "EVIDENCE_REFERENCES_ONLY",
    "retrieved_content_is_instruction": false
  },
  "language": "zh-Hant",
  "lifecycle": {
    "activation_requires_total_field_receipt": true,
    "replacement_refs": [
      "w7tp.total-field.skill-governance@1.0.0",
      "w7tp.total-field.skill-governance@2.1.0",
      "w7tp.total-field.skill-governance@2.2.0",
      "w7tp.total-field.skill-governance@2.3.0"
    ],
    "retirement_preserves_evidence": true,
    "session_revocation_on_seat_or_profile_change": true,
    "state": "CANDIDATE_FOR_TOTAL_FIELD_REVIEW",
    "suspension_triggers": [
      "MANIFEST_OR_IMPLEMENTATION_HASH_DRIFT",
      "IDENTITY_PROFILE_OR_SEAT_INVALID",
      "OPEN_HIGH_OR_CRITICAL_RED_TEAM_FINDING",
      "PRODUCT_OUTPUT_OR_VERIFIER_FAILURE",
      "PROTECTED_DATA_OR_CROSS_MEMBER_BOUNDARY_VIOLATION",
      "CANONICAL_REPLACEMENT",
      "TECHNOLOGY_IDENTITY_GATE_MISSING_OR_DRIFT",
      "FLOATING_POINT_DATA_INDEX_CONTRACT_DRIFT"
    ],
    "total_field_decision_ref": null
  },
  "manifest_state": "CANDIDATE_FOR_TOTAL_FIELD_REVIEW",
  "product_output_contract": {
    "acceptance_criteria": [
      "JSON Schema 可解析",
      "正式 manifest 通過語意驗證",
      "舊 V2 canonical ref 被阻擋",
      "意圖通訊、ADI 整數決策索引與時空索引網路完整，宣告浮點運算時浮點資料索引、數值契約及重播證據完整，H64-TD 只可引用、10/21 請求項沿革與 append-only 鎖完整",
      "對抗案例均被阻擋",
      "技術比較具備六軸、離散裁決、EV 證據與專利推論禁止契約",
      "技能盤點能辨識未登錄、重名與無效 manifest",
      "沒有雲端呼叫或正式環境副作用"